id,title,description,category,location,budget_min,budget_max,quantity,source,url,contact
RD001,Reddit buyer looking for private label athletic wear manufacturer,"Buyer asks for private label athletic wear manufacturer, USA preferred, indicating sourcing demand and need for trustworthy manufacturing partner.",apparel/oem,USA,,,,reddit,https://www.reddit.com/r/smallbusiness/comments/1deke1x/looking_for_manufacturer_of_private_label/,reddit-post
RD002,Reddit buyer looking for women fashion manufacturer,"Buyer post seeking manufacturer for women fashion products, representing apparel sourcing demand.",apparel/oem,Global,,,,reddit,https://www.reddit.com/r/smallbusiness/comments/1ow53ym/looking_for_manufacturer_women_fashion/,reddit-post
RD003,Reddit discussion on how to find suppliers,Manufacturing community thread with explicit need to find suppliers and source production partners.,general-sourcing,Global,,,,reddit,https://www.reddit.com/r/manufacturing/comments/1gz2ncf/how_to_find_suppliers/,reddit-post
RD004,Brand wants collagen serum private label support,Brand-side demand inferred from search intent around private label collagen serum and custom skincare manufacturing.,beauty/oem,Global,,,,web_search,https://sogoplaza.com/collections/oem-private-label-customized-collagen-serum-essence,web-form
RD005,Buyer needs private label gummy supplement manufacturer,Search-grounded demand for private label gummy supplement manufacturing with customization and formulation support.,nutraceutical/private-label,Global,,,,web_search,https://www.thomasnet.com/articles/top-suppliers/private-label-gummy-supplements-manufacturers-suppliers/,directory
RD006,Buyer sourcing disposable nitrile gloves with OEM options,Demand signal for disposable nitrile gloves and OEM/ODM manufacturing capability for PPE buyers.,medical-supplies,Global,,,,web_search,https://bornovamedical.com/pages/oem-gloves-1,web-form
RD007,Buyer seeking bamboo furniture wholesale and custom packaging,"Demand signal for bamboo furniture buyers seeking wholesale, customization, and logistics support.",furniture/b2b,Global,,,,web_search,https://www.bamboovision.com/wholesale-bamboo-products-worldwide,web-form
RD008,Buyer seeking compostable packaging supplier,Demand for OEM packaging and eco packaging manufacturing inferred from packaging supplier search results.,packaging,Global,,,,web_search,https://pioneerphoenix.com/what-is-oem-packaging/,web-form
